{
  "apiVersion": "workflow/v2alpha",
  "kind": "Workflow",
  "metadata": {
    "name": "empty-sections",
    "version": "1.0.0"
  },
  "types": {},
  "constants": {},
  "contextSchema": {},
  "operations": {
    "work": {
      "ref": "java:test.work:v1"
    }
  },
  "nodes": [
    {
      "id": "do",
      "kind": "task",
      "operation": "work"
    },
    {
      "id": "done",
      "kind": "terminate",
      "status": "completed"
    }
  ],
  "edges": [
    {
      "from": "do",
      "to": "done",
      "when": {
        "kind": "always"
      }
    }
  ],
  "entrypoint": "do",
  "outputs": {}
}
